{
  "artifacts": [
    {
      "path": "artifacts/autosci/runs/shim-side-effect-access-generate_ideas/generate_ideas_approval_contract.json",
      "type": "approval_contract_json"
    },
    {
      "path": "artifacts/autosci/runs/shim-side-effect-access-generate_ideas/generate_ideas_gate_policy_decision.json",
      "type": "gate_policy_decision_json"
    },
    {
      "path": "artifacts/autosci/runs/shim-side-effect-access-generate_ideas/wiki_state_resolver.json",
      "type": "wiki_state_resolver_json"
    },
    {
      "path": "artifacts/autosci/runs/shim-side-effect-access-generate_ideas/ideate_final_promotion_boundary.json",
      "type": "ideate_final_promotion_boundary_json"
    },
    {
      "path": "artifacts/autosci/runs/shim-side-effect-access-generate_ideas/ideate_pipeline_report.json",
      "type": "ideate_pipeline_report_json"
    },
    {
      "path": "artifacts/autosci/runs/shim-side-effect-access-generate_ideas/ideate_pilot_handoff_boundary.json",
      "type": "ideate_pilot_handoff_boundary_json"
    },
    {
      "path": "artifacts/autosci/runs/shim-side-effect-access-generate_ideas/ideate_growth_report.json",
      "type": "ideate_growth_report_json"
    },
    {
      "path": "artifacts/autosci/runs/shim-side-effect-access-generate_ideas/generate_ideas_source_provider_runtime_proof.json",
      "type": "provider_source_runtime_proof_manifest_json"
    },
    {
      "path": "artifacts/autosci/runs/shim-side-effect-access-generate_ideas/generate_ideas_side_effect_access_request.json",
      "type": "side_effect_access_request_json"
    },
    {
      "path": "artifacts/autosci/runs/shim-side-effect-access-generate_ideas/idea_candidate.json",
      "type": "solar_evidence_json"
    }
  ],
  "inputs": {
    "claims_evidence": "artifacts/autosci/runs/shim-side-effect-access-generate_ideas/research_claims.json",
    "gate_mode": "strict_hitl",
    "memory_evidence": "artifacts/autosci/runs/shim-side-effect-access-generate_ideas/research_memory_update.json",
    "method_evidence": "artifacts/autosci/runs/shim-side-effect-access-generate_ideas/research_method.json",
    "native_options": {
      "add": "",
      "affiliation_logo": "",
      "after_artifacts": [],
      "all": false,
      "allowlist_evidence": [],
      "anonymous": false,
      "approval_ref": "",
      "authors": "",
      "auto": false,
      "auto_figures": false,
      "before_artifacts": [],
      "canvas": false,
      "checklist": false,
      "claims_evidence": [],
      "code_evidence": [],
      "collect": false,
      "collect_ready": false,
      "compile_after_artifacts": [],
      "compile_allowlist_evidence": [],
      "compile_approval_ref": "",
      "compile_before_artifacts": [],
      "compile_execute_approved": false,
      "compile_executor_timeout_seconds": 120,
      "compile_runtime_evidence": [],
      "compile_target": "",
      "conference_logo": "",
      "crystallize": false,
      "daily_categories": [],
      "daily_decisions": "",
      "daily_feed": "",
      "daily_hours": 0,
      "daily_max_auto_ingest": 0,
      "daily_max_recommendations": 0,
      "daily_mode": "",
      "daily_no_external": false,
      "daily_send_email": "",
      "depth": 0,
      "difficulty": "",
      "discover": false,
      "double_blind": false,
      "edge_types": "",
      "env": "",
      "execute_approved": false,
      "experiment_after_artifacts": [],
      "experiment_allowlist_evidence": [],
      "experiment_approval_ref": "",
      "experiment_before_artifacts": [],
      "experiment_execute_approved": false,
      "experiment_executor_timeout_seconds": 120,
      "experiment_result_evidence": [],
      "experiment_runtime_evidence": [],
      "fix": false,
      "focus": "",
      "format": "",
      "full": false,
      "idea_approval_ref": "",
      "layout": "",
      "lifecycle_summary": [],
      "max_ideas": 0,
      "max_rounds": 0,
      "min_font_size": null,
      "model_command": "",
      "model_evidence": [],
      "no_figures": false,
      "no_introduction": false,
      "no_logos": false,
      "no_refine": false,
      "novelty_evidence": [],
      "obsidian": false,
      "online": false,
      "page_count": null,
      "page_limit": null,
      "paper_slug": "",
      "pdf_inspection": "",
      "pilot_handoff_evidence": [],
      "pilot_runtime_evidence": [],
      "pipeline": "",
      "quick": false,
      "refine_iterations": 0,
      "remote_check_command": "",
      "remote_run_dir": "",
      "render": false,
      "require_review_llm": false,
      "results_approval_ref": "",
      "review": false,
      "review_llm_command": "",
      "review_llm_endpoint": "",
      "review_llm_evidence": [],
      "review_llm_model": "",
      "review_llm_provider": "",
      "reviewer_thread_evidence": [],
      "runtime_evidence": [],
      "scheduler_demo": false,
      "scheduler_dispatch_external_evidence": false,
      "scheduler_include_blocked_external": false,
      "scheduler_include_human_gates": false,
      "scheduler_legacy_smoke_runner": false,
      "scheduler_node_id": [],
      "scheduler_require_workflow_config_alignment": false,
      "scheduler_run": false,
      "scheduler_timeout": 30.0,
      "scope": "",
      "serve": false,
      "skip_paper": false,
      "skip_pilot": false,
      "skip_validation": true,
      "source_evidence": [],
      "start_from": "",
      "stress_test": null,
      "submission_audit": "",
      "submission_mode": "",
      "submission_profile": "",
      "target_score": 0.0,
      "title": "",
      "types": "",
      "verbose": false,
      "verified_min_font_size": null,
      "verified_page_count": null,
      "visualize": false,
      "write": false
    },
    "paper_evidence": "artifacts/autosci/runs/shim-side-effect-access-generate_ideas/research_paper.json",
    "skip_validation": true,
    "smoke_mode": false,
    "topic": "skillgen ideas"
  },
  "limitations": [
    "Ideas are source-grounded deterministic candidates; external novelty and Review LLM validation remain required.",
    "Failed idea overlap is checked with token overlap and should be reviewed by a human.",
    "Target `skillgen ideas` was not found in wiki ideas, experiments, outputs, or graph edges.",
    "Resolver is read-only; it does not mutate wiki state, add graph edges, or rebuild wiki indexes.",
    "Frontmatter parsing supports scalar values and simple lists only; complex YAML is reported through missing fields.",
    "Final idea promotion requires wiki maturity scan, failed-idea banlist check, source-backed evidence, model brainstorm provenance, and novelty/review gate evidence references.",
    "Native /ideate full parity requires completed landscape scan, independent dual-model brainstorm, novelty/review validation, approved wiki writeback, pilot handoff or explicit skip, and A/B/C/D/E generation-path coverage.",
    "Side-effect access is required; no protected native side effects were executed."
  ],
  "node_id": "node-generate-ideas",
  "outputs": {
    "blocking_reasons": [
      "read_local is allowed in strict_hitl.",
      "write_artifact is allowed in strict_hitl.",
      "network_fetch requires HITL approval in strict_hitl.",
      "local_command requires HITL approval in strict_hitl.",
      "wiki_mutation requires HITL approval in strict_hitl."
    ],
    "ideas": [
      {
        "approach": "Build an experiment plan from the shared assumptions and limitations in the cited wiki/discovery sources, then compare it against the strongest baseline found in the evidence graph.",
        "duplicate_of": "",
        "duplicate_status": "new",
        "final_promotion_boundary": {
          "blocking_reasons": [
            "model brainstorm provenance is missing or incomplete",
            "novelty/review gate evidence references are missing",
            "generation path coverage A/B/C/D/E is incomplete"
          ],
          "duplicate_status": "new",
          "generation_path": "A:landscape-driven",
          "idea_id": "idea-wiki-discovery-001",
          "promotion_ready": false,
          "schema": "autosci_ideate_idea_promotion_boundary.v1",
          "source_mode": "wiki",
          "status": "idea_promotion_incomplete"
        },
        "generation_path": "A:landscape-driven",
        "grounding_summary": "Primary source: Open Questions; secondary source: Context Brief.",
        "hypothesis": "Combining `Open Questions` with `Context Brief` can expose a testable gap that is not captured by single-source reading.",
        "idea_id": "idea-wiki-discovery-001",
        "novelty_hypothesis": "The candidate is grounded in current wiki/discovery evidence and targets an explicit evidence gap.",
        "origin_evidence_ids": [
          "wiki:graph/open_questions.md",
          "wiki:graph/context_brief.md"
        ],
        "promotion_ready": false,
        "selected_for_write": true,
        "selection_rank": 1,
        "source_mode": "wiki",
        "status": "candidate",
        "title": "Close the evidence gap around skillgen ideas"
      }
    ],
    "policy_decision": {
      "action": "generate_ideas",
      "allow_destructive": false,
      "allow_email": false,
      "allow_network": false,
      "allow_remote": false,
      "allowed": false,
      "allowed_write_roots": [
        "artifacts/autosci",
        "artifacts/scientific"
      ],
      "blocked": true,
      "execute_side_effects": false,
      "mode": "strict_hitl",
      "proof_best_effort": false,
      "proof_required": true,
      "reasons": [
        "read_local is allowed in strict_hitl.",
        "write_artifact is allowed in strict_hitl.",
        "network_fetch requires HITL approval in strict_hitl.",
        "local_command requires HITL approval in strict_hitl.",
        "wiki_mutation requires HITL approval in strict_hitl."
      ],
      "require_approval_ref": true,
      "require_before_after_artifacts": true,
      "require_hitl": true,